{"$schema":"https://json-schema.org/draft/2020-12/schema","title":"edge.analytics/v1 row","type":"object","required":["zone_hash","host","path","period","metrics"],"properties":{"zone_hash":{"type":"string"},"zone_label":{"type":"string"},"host":{"type":["string","null"]},"path":{"type":["string","null"]},"period":{"type":"object"},"metrics":{"type":"array","maxItems":64,"items":{"type":"object"}}},"additionalProperties":false}
