{"zone_hash":"sha256:synthetic","host":"example.com","path":null,"period":{"start":"2026-09-01","end":"2026-09-02","granularity":"day","time_zone":"UTC"},"metrics":[{"metric_id":"cloudflare.requests","semantic_family":"edge_request_count","value":42,"unit":"requests","estimated":false,"definition_version":"httpRequests1dGroups/2026-09-02","comparison_key":"cloudflare.requests/httpRequests1dGroups","source_field":"requests"}]}
